{
  "schema_version": "atlas.evidence_envelope.v1",
  "envelope_id": "env-approval-event-001",
  "envelope_type": "approval_event",
  "created_at": "2026-06-04T00:03:00Z",
  "producer": {
    "name": "atlas-approval-plane",
    "version": "draft",
    "source_ref": "approval/approval-plane.yaml"
  },
  "actor": {
    "id": "local:user:reviewer",
    "type": "human",
    "display": "Local reviewer"
  },
  "subject": {
    "type": "approval_request",
    "ref": "approval:atlas.cloud_change_proposal_review",
    "summary": "Approval request metadata for a future cloud change proposal"
  },
  "action": {
    "id": "atlas.cloud_change.propose",
    "class": "propose",
    "mode": "propose",
    "requested_effect": "Request review of a future cloud change proposal.",
    "actual_effect": "Approval metadata only; no workflow execution occurred."
  },
  "capability": {
    "id": "atlas.cloud.change.propose",
    "class": "propose",
    "known": true,
    "status": "known"
  },
  "adapter": {
    "id": "cloud.change.propose",
    "mode": "propose",
    "known": true,
    "live_integration": false,
    "source_system": "cloud change proposal metadata"
  },
  "policy": {
    "decision": "approval_required",
    "bundle_refs": [
      "atlas.propose_requires_approval_path",
      "atlas.evidence_required_for_decision"
    ],
    "reason_refs": [
      "Future state-changing proposals require approval path and evidence metadata."
    ],
    "boundary_violations": [],
    "runtime_enforcement": false
  },
  "approval": {
    "state": "requested",
    "workflow_id": "atlas.cloud_change_proposal_review",
    "required": true,
    "approver_refs": [
      "role:change-reviewer"
    ],
    "decision_ref": "approval-request:cloud-change-example",
    "expires_at": "2026-06-11T00:03:00Z",
    "reapproval_required": false
  },
  "evidence": {
    "refs": [
      "change-summary:metadata-ref",
      "risk-review:metadata-ref"
    ],
    "sufficiency_status": "present",
    "missing": [],
    "stale": [],
    "unverifiable": [],
    "outside_atlas": []
  },
  "artifacts": {
    "refs": [
      "approvals/cloud-change-proposal.md"
    ],
    "hashes": [
      "sha256:example-cloud-change-proposal-hash"
    ],
    "source_refs": [
      "approval/approval-plane.yaml"
    ]
  },
  "hashes": {
    "event_hash": null,
    "prev_hash": null,
    "receipt_hash": null,
    "content_hash": null,
    "chain_head": null
  },
  "review": {
    "summary": "Approval state is requested for a proposal-only workflow.",
    "supported_decision": "Reviewer can see requested approver role, expiration, and evidence refs.",
    "unsupported_decisions": [
      "This envelope does not execute approval workflow or cloud mutation.",
      "This envelope does not prove the action is valid or production deployable."
    ],
    "human_judgment_required": true,
    "replay_hint": "Inspect approval/approval-plane.yaml and referenced approval metadata."
  },
  "privacy": {
    "metadata_only": true,
    "raw_artifacts_embedded": false,
    "forbidden_content_excluded": true,
    "redaction_required": false,
    "sensitive_data_classes_excluded": [
      "raw logs",
      "secrets",
      "private keys",
      "tokens",
      "Authorization headers",
      "request bodies",
      "response bodies",
      "packet captures",
      "raw prompts",
      "raw model outputs",
      "customer data",
      "payment data",
      "private business records",
      "unredacted evidence bodies",
      "raw artifacts",
      "full tool output bodies",
      "browser session material",
      "session cookies"
    ]
  },
  "known_limitations": [
    "This approval event envelope is metadata-only.",
    "It does not add approval engine execution, automatic approval, automatic escalation, or break-glass execution.",
    "Approval metadata does not grant authorization by itself.",
    "Approval metadata does not prove action validity.",
    "It does not prove legal compliance, legal sufficiency, production approval, or complete event coverage."
  ]
}
